{
  "cardId": "chase-aeroplan",
  "currentOffers": [
    {
      "offerType": "public",
      "rewardAmount": 85000,
      "rewardUnit": "miles",
      "spendRequirement": 4000,
      "timeframeDays": 90
    }
  ],
  "history": [
    {
      "rewardAmount": 60000,
      "rewardUnit": "miles",
      "spendRequirement": 4000,
      "observedDate": "2026-03-21"
    },
    {
      "rewardAmount": 100000,
      "rewardUnit": "miles",
      "spendRequirement": 3000,
      "observedDate": "2024-10-01"
    }
  ],
  "sourceMeta": {
    "lastReviewedDate": "2026-08-04",
    "sourceUrls": [
      "https://creditcards.chase.com/travel-credit-cards/aircanada/aeroplan"
    ],
    "updatedBy": "agent"
  }
}
