{
  "cardId": "barclays-jetblue-business",
  "currentOffers": [
    {
      "offerType": "public",
      "rewardAmount": 60000,
      "rewardUnit": "miles",
      "spendRequirement": 6000,
      "timeframeDays": 365
    }
  ],
  "history": [
    {
      "rewardAmount": 60000,
      "rewardUnit": "miles",
      "spendRequirement": 2000,
      "observedDate": "2025-06-01"
    }
  ],
  "sourceMeta": {
    "lastReviewedDate": "2026-08-04",
    "sourceUrls": [
      "https://cards.barclaycardus.com/banking/cards/jetblue-business-card/"
    ],
    "updatedBy": "agent"
  }
}
