{
  "cardId": "citi-strata",
  "currentOffers": [
    {
      "offerType": "public",
      "rewardAmount": 20000,
      "rewardUnit": "points",
      "spendRequirement": 1000,
      "timeframeDays": 90
    }
  ],
  "history": [
    {
      "rewardAmount": 30000,
      "rewardUnit": "points",
      "spendRequirement": 1000,
      "observedDate": "2026-08-04"
    }
  ],
  "sourceMeta": {
    "lastReviewedDate": "2026-08-04",
    "sourceUrls": [
      "https://www.citi.com/credit-cards/citi-strata-credit-card"
    ],
    "updatedBy": "agent"
  }
}
