{
  "cardId": "barclays-jetblue-premier",
  "currentOffers": [
    {
      "offerType": "public",
      "rewardAmount": 80000,
      "rewardUnit": "miles",
      "spendRequirement": 5000,
      "timeframeDays": 90
    }
  ],
  "history": [
    {
      "rewardAmount": 80000,
      "rewardUnit": "miles",
      "spendRequirement": 5000,
      "observedDate": "2026-08-04"
    }
  ],
  "sourceMeta": {
    "lastReviewedDate": "2026-08-04",
    "sourceUrls": [
      "https://cards.barclaycardus.com/banking/cards/jetblue-premier-card/"
    ],
    "updatedBy": "agent"
  }
}
