{
  "cardId": "first-national-bank-of-omaha-best-western-rewards",
  "currentOffers": [
    {
      "offerType": "public",
      "rewardAmount": 40000,
      "rewardUnit": "miles",
      "spendRequirement": 1000,
      "timeframeDays": 90
    }
  ],
  "history": [
    {
      "rewardAmount": 50000,
      "rewardUnit": "miles",
      "spendRequirement": 1000,
      "observedDate": "2026-08-04"
    }
  ],
  "sourceMeta": {
    "lastReviewedDate": "2026-08-04",
    "sourceUrls": [
      "https://www.bestwestern.com/en_US/offers/hotel-discounts/best-western-rewards-visa.html"
    ],
    "updatedBy": "agent"
  }
}
