{
  "cardId": "comenity-aaa-travel-advantage",
  "currentOffers": [
    {
      "offerType": "public",
      "rewardAmount": 100,
      "rewardUnit": "cashback_usd",
      "spendRequirement": 1000,
      "timeframeDays": 90
    }
  ],
  "history": [
    {
      "rewardAmount": 100,
      "rewardUnit": "cashback_usd",
      "spendRequirement": 1000,
      "observedDate": "2026-08-04"
    }
  ],
  "sourceMeta": {
    "lastReviewedDate": "2026-08-04",
    "sourceUrls": [
      "https://www.ace.aaa.com/financial/aaa-credit-card.html"
    ],
    "updatedBy": "agent"
  }
}
