{
  "cardId": "u-s-bank-business-altitude-power",
  "currentOffers": [
    {
      "offerType": "public",
      "rewardAmount": 75000,
      "rewardUnit": "points",
      "spendRequirement": 10000,
      "timeframeDays": 120
    }
  ],
  "history": [
    {
      "rewardAmount": 75000,
      "rewardUnit": "points",
      "spendRequirement": 10000,
      "observedDate": "2026-08-04"
    }
  ],
  "sourceMeta": {
    "lastReviewedDate": "2026-08-04",
    "sourceUrls": [
      "https://www.usbank.com/business-banking/business-credit-cards/business-altitude-power-world-elite-mastercard.html"
    ],
    "updatedBy": "agent"
  }
}
