{
  "cardId": "wells-fargo-expedia-one-key",
  "currentOffers": [
    {
      "offerType": "public",
      "rewardAmount": 250,
      "rewardUnit": "miles",
      "spendRequirement": 1000,
      "timeframeDays": 90
    }
  ],
  "history": [
    {
      "rewardAmount": 300,
      "rewardUnit": "miles",
      "spendRequirement": 1000,
      "observedDate": "2026-04-28"
    },
    {
      "rewardAmount": 400,
      "rewardUnit": "miles",
      "spendRequirement": 1000,
      "observedDate": "2026-08-04"
    }
  ],
  "sourceMeta": {
    "lastReviewedDate": "2026-08-04",
    "sourceUrls": [
      "https://www.expedia.com/one-key-cards"
    ],
    "updatedBy": "agent"
  }
}
