{
  "cardId": "american-express-rakuten-business",
  "currentOffers": [
    {
      "offerType": "public",
      "rewardAmount": 25,
      "rewardUnit": "cashback_usd",
      "spendRequirement": 500,
      "timeframeDays": 90
    }
  ],
  "history": [
    {
      "rewardAmount": 25,
      "rewardUnit": "cashback_usd",
      "spendRequirement": 500,
      "observedDate": "2026-08-04"
    }
  ],
  "sourceMeta": {
    "lastReviewedDate": "2026-08-04",
    "sourceUrls": [
      "https://www.rakuten.com/american-express-card/"
    ],
    "updatedBy": "agent"
  }
}
