{
  "cardId": "american-express-everyday",
  "currentOffers": [
    {
      "offerType": "public",
      "rewardAmount": 0,
      "rewardUnit": "points",
      "spendRequirement": 3000,
      "timeframeDays": 90
    }
  ],
  "history": [
    {
      "rewardAmount": 0,
      "rewardUnit": "points",
      "spendRequirement": 3000,
      "observedDate": "2026-08-04"
    }
  ],
  "sourceMeta": {
    "lastReviewedDate": "2026-08-04",
    "sourceUrls": [
      "https://global.americanexpress.com/card-benefits/view-all/amex-everyday"
    ],
    "updatedBy": "agent"
  }
}
