{
  "cardId": "bank-of-america-atmos-rewards-business",
  "currentOffers": [
    {
      "offerType": "public",
      "rewardAmount": 80000,
      "rewardUnit": "miles",
      "spendRequirement": 4000,
      "timeframeDays": 120
    }
  ],
  "history": [
    {
      "rewardAmount": 80000,
      "rewardUnit": "miles",
      "spendRequirement": 5000,
      "observedDate": "2026-08-04"
    }
  ],
  "sourceMeta": {
    "lastReviewedDate": "2026-08-04",
    "sourceUrls": [
      "https://www.alaskaair.com/atmosrewards/content/credit-cards"
    ],
    "updatedBy": "agent"
  }
}
