{
  "cardId": "citi-aadvantage-globe",
  "currentOffers": [
    {
      "offerType": "public",
      "rewardAmount": 90000,
      "rewardUnit": "miles",
      "spendRequirement": 5000,
      "timeframeDays": 120
    }
  ],
  "history": [
    {
      "rewardAmount": 90000,
      "rewardUnit": "miles",
      "spendRequirement": 5000,
      "observedDate": "2026-08-04"
    }
  ],
  "sourceMeta": {
    "lastReviewedDate": "2026-08-04",
    "sourceUrls": [
      "https://creditcards.aa.com/credit-cards/citi-globe-card-american-airlines-direct/"
    ],
    "updatedBy": "agent"
  }
}
