{
  "cardId": "barclays-wyndham-rewards-earner-business",
  "currentOffers": [
    {
      "offerType": "public",
      "rewardAmount": 45000,
      "rewardUnit": "miles",
      "spendRequirement": 3000,
      "timeframeDays": 90
    }
  ],
  "history": [
    {
      "rewardAmount": 90000,
      "rewardUnit": "miles",
      "spendRequirement": 2000,
      "observedDate": "2026-08-04"
    }
  ],
  "sourceMeta": {
    "lastReviewedDate": "2026-08-04",
    "sourceUrls": [
      "https://www.wyndhamrewardscreditcard.com/#earnerbusiness"
    ],
    "updatedBy": "agent"
  }
}
